{
  "id": 0,
  "category": {
    "id": 0,
    "name": "Grande"
  },
  "name": "Brutus",
  "photoUrls": [
    "https://dnl7t01l0fo05.cloudfront.net/fr/wp-content/uploads/sites/2/2018/04/brutus-bullmastiff.jpg"
  ],
  "tags": [
    {
      "id": 0,
      "name": "Cachorro"
    }
  ],
  "status": "available"
}